{
  "version": "1.0",
  "project_id": "collapse-topic-pilot-2026-08-12",
  "generated_at": "2026-08-12T07:37:20Z",
  "provisional": true,
  "scope_definition": "physical collapse of a human-made building or structure",
  "scorecard_ref": "config/topic-selection-scorecard.yaml",
  "candidates": [
    {
      "id": "hyatt-regency-walkways",
      "title": "하얏트 리젠시 보행로 붕괴",
      "location": "Kansas City, Missouri, United States",
      "collapse_date": "1981-07-17",
      "structure_type": "suspended hotel walkways",
      "collapse_extent": "partial",
      "one_line_question": "한 번의 연결부 설계 변경은 어떻게 두 개의 보행로를 동시에 떨어뜨렸나?",
      "provisional": true,
      "scope": {"human_made_structure": true, "physical_collapse": true, "scope_verified": true},
      "sources": [{
        "title": "Walkway Collapse, Kansas City, Missouri, 1981",
        "institution": "National Institute of Standards and Technology",
        "class": "official_or_primary",
        "url": "https://www.nist.gov/el/walkway-collapse-kansas-city-missouri-1981",
        "supports": "NIST records the July 17, 1981 physical collapse of the second- and fourth-floor suspended walkways."
      }],
      "korean_youtube_landscape": {"query": "하얏트 리젠시 보행로 붕괴 원인", "checked_at": "2026-08-12T07:37:20Z", "assessment": "한국어 경쟁도와 중복도는 YouTube Data 후속 검증 전인 잠정 평가다."},
      "scores": {"event_pull": 4, "causal_depth": 5, "belief_reversal": 4, "evidence_verifiability": 5, "narrative_expandability": 4, "visual_explainability": 5, "meaning_and_lessons": 5, "korean_content_scarcity": 3},
      "score_reasons": {
        "event_pull": "호텔 내부의 대형 인명 참사로 도입 흡인력이 크다.",
        "causal_depth": "설계 변경·검토·시공 책임이 연쇄적으로 연결된다.",
        "belief_reversal": "작은 연결 상세가 전체 하중 경로를 바꾼다.",
        "evidence_verifiability": "NIST 공식 조사와 구조 계산 근거가 명확하다.",
        "narrative_expandability": "설계부터 붕괴와 제도 변화까지 확장 가능하다.",
        "visual_explainability": "행어로드와 박스빔 하중을 단면도로 설명하기 쉽다.",
        "meaning_and_lessons": "설계 변경 검토와 책임 체계의 교훈이 선명하다.",
        "korean_content_scarcity": "한국어 심층 다큐 경쟁도는 아직 잠정치다."
      }
    },
    {
      "id": "champlain-towers-south",
      "title": "챔플레인 타워 사우스 붕괴",
      "location": "Surfside, Florida, United States",
      "collapse_date": "2021-06-24",
      "structure_type": "12-story reinforced-concrete condominium",
      "collapse_extent": "partial",
      "one_line_question": "사람들이 살던 해안 콘도는 왜 새벽에 예고 없이 무너졌나?",
      "provisional": true,
      "scope": {"human_made_structure": true, "physical_collapse": true, "scope_verified": true},
      "sources": [{
        "title": "Champlain Towers South Collapse",
        "institution": "National Institute of Standards and Technology",
        "class": "official_or_primary",
        "url": "https://www.nist.gov/disaster-and-failure-studies/champlain-towers-south-collapse",
        "supports": "NIST records the sudden partial collapse of the 12-story condominium on June 24, 2021."
      }],
      "korean_youtube_landscape": {"query": "챔플레인 타워 붕괴 원인", "checked_at": "2026-08-12T07:37:20Z", "assessment": "최근 사건이라 알려졌지만 한국어 심층 경쟁도는 후속 정량 검증이 필요하다."},
      "scores": {"event_pull": 5, "causal_depth": 4, "belief_reversal": 4, "evidence_verifiability": 4, "narrative_expandability": 5, "visual_explainability": 4, "meaning_and_lessons": 5, "korean_content_scarcity": 4},
      "score_reasons": {
        "event_pull": "현대 주거 건물이 새벽에 붕괴한 충격이 매우 크다.",
        "causal_depth": "설계·열화·유지관리 가설을 층별로 다룰 수 있다.",
        "belief_reversal": "평범한 주거 공간의 안전 신뢰를 뒤집는다.",
        "evidence_verifiability": "NIST 조사가 진행 중이라 일부 결론은 유보해야 한다.",
        "narrative_expandability": "건물 생애주기와 경고 신호까지 서사를 넓힐 수 있다.",
        "visual_explainability": "주차장·수영장 데크·기둥 관계를 공간적으로 보여줄 수 있다.",
        "meaning_and_lessons": "노후 건물 점검과 보수 의사결정의 교훈이 크다.",
        "korean_content_scarcity": "심층 구조 분석형 한국어 콘텐츠는 잠정적으로 드물다."
      }
    },
    {
      "id": "fiu-pedestrian-bridge",
      "title": "FIU 보행교 붕괴",
      "location": "Miami, Florida, United States",
      "collapse_date": "2018-03-15",
      "structure_type": "pedestrian bridge under construction",
      "collapse_extent": "partial",
      "one_line_question": "균열이 보였는데도 왜 보행교 아래의 도로는 계속 열려 있었나?",
      "provisional": true,
      "scope": {"human_made_structure": true, "physical_collapse": true, "scope_verified": true},
      "sources": [{
        "title": "Pedestrian Bridge Collapse Over SW 8th Street, Miami, Florida",
        "institution": "National Transportation Safety Board",
        "class": "official_or_primary",
        "url": "https://www.ntsb.gov/investigations/pages/hwy18mh009.aspx",
        "supports": "NTSB records the March 15, 2018 structural failure and collapse of the bridge span onto the roadway."
      }],
      "korean_youtube_landscape": {"query": "FIU 보행교 붕괴 원인", "checked_at": "2026-08-12T07:37:20Z", "assessment": "국내 토목 요약물과의 중복 여부는 후속 YouTube 검색으로 확인해야 한다."},
      "scores": {"event_pull": 4, "causal_depth": 5, "belief_reversal": 4, "evidence_verifiability": 5, "narrative_expandability": 3, "visual_explainability": 5, "meaning_and_lessons": 4, "korean_content_scarcity": 4},
      "score_reasons": {
        "event_pull": "운행 중 도로 위 신설 교량 붕괴라는 긴박감이 크다.",
        "causal_depth": "설계 계산·균열 판단·현장 통제 실패가 겹친다.",
        "belief_reversal": "혁신 공법 홍보와 실제 위험의 대비가 강하다.",
        "evidence_verifiability": "NTSB 공개 조사 기록과 계산 근거가 풍부하다.",
        "narrative_expandability": "사건 범위는 선명하지만 장기 서사는 비교적 짧다.",
        "visual_explainability": "트러스 절점과 균열 진행을 도식화하기 좋다.",
        "meaning_and_lessons": "위험 신호 발견 뒤 통제 결정의 중요성을 보여준다.",
        "korean_content_scarcity": "한국어 심층 분석의 희소성은 잠정적으로 높다."
      }
    },
    {
      "id": "i35w-mississippi-bridge",
      "title": "I-35W 미시시피강 교량 붕괴",
      "location": "Minneapolis, Minnesota, United States",
      "collapse_date": "2007-08-01",
      "structure_type": "deck-truss highway bridge",
      "collapse_extent": "partial",
      "one_line_question": "수십 년을 버틴 고속도로 교량은 왜 저녁 교통량 속에서 한꺼번에 내려앉았나?",
      "provisional": true,
      "scope": {"human_made_structure": true, "physical_collapse": true, "scope_verified": true},
      "sources": [{
        "title": "Collapse of I-35W Highway Bridge, Minneapolis, Minnesota",
        "institution": "National Transportation Safety Board",
        "class": "official_or_primary",
        "url": "https://www.ntsb.gov/investigations/Pages/HWY07MH024.aspx",
        "supports": "NTSB records the August 1, 2007 collapse of the deck-truss bridge main span and identifies undersized gusset plates."
      }],
      "korean_youtube_landscape": {"query": "I-35W 교량 붕괴 원인", "checked_at": "2026-08-12T07:37:20Z", "assessment": "사건 인지도 대비 한국어 장편 분석 경쟁도는 후속 확인이 필요하다."},
      "scores": {"event_pull": 4, "causal_depth": 5, "belief_reversal": 4, "evidence_verifiability": 5, "narrative_expandability": 4, "visual_explainability": 5, "meaning_and_lessons": 5, "korean_content_scarcity": 3},
      "score_reasons": {
        "event_pull": "도심 고속도로가 교통 중 붕괴해 즉각적 긴장이 높다.",
        "causal_depth": "원설계·증가 하중·점검 체계를 함께 분석할 수 있다.",
        "belief_reversal": "겉보기 부식보다 원래 설계 상세가 핵심이었다.",
        "evidence_verifiability": "NTSB 보고서와 시험 자료가 체계적으로 남아 있다.",
        "narrative_expandability": "건설부터 유지관리와 제도 개선까지 연결 가능하다.",
        "visual_explainability": "거셋플레이트 좌굴과 하중 경로를 명확히 시각화할 수 있다.",
        "meaning_and_lessons": "기존 인프라의 원설계 재검증 필요성을 보여준다.",
        "korean_content_scarcity": "국내에 알려진 사건이라 희소성은 잠정 중간이다."
      }
    },
    {
      "id": "wtc-7",
      "title": "세계무역센터 7번 건물 붕괴",
      "location": "New York City, New York, United States",
      "collapse_date": "2001-09-11",
      "structure_type": "47-story steel-framed office building",
      "collapse_extent": "whole",
      "one_line_question": "항공기 충돌이 없던 47층 건물은 왜 그날 오후 완전히 붕괴했나?",
      "provisional": true,
      "scope": {"human_made_structure": true, "physical_collapse": true, "scope_verified": true},
      "sources": [{
        "title": "Final Report on the Collapse of World Trade Center Building 7",
        "institution": "National Institute of Standards and Technology",
        "class": "official_or_primary",
        "url": "https://www.nist.gov/publications/final-report-collapse-world-trade-center-building-7-federal-building-and-fire-safety-0",
        "supports": "NIST concludes that uncontrolled fires led to progressive structural collapse of WTC 7 on September 11, 2001."
      }],
      "korean_youtube_landscape": {"query": "WTC 7 붕괴 NIST 원인", "checked_at": "2026-08-12T07:37:20Z", "assessment": "관련 영상은 많지만 근거 중심 한국어 설명의 경쟁도는 별도 확인이 필요하다."},
      "scores": {"event_pull": 5, "causal_depth": 4, "belief_reversal": 5, "evidence_verifiability": 4, "narrative_expandability": 5, "visual_explainability": 4, "meaning_and_lessons": 4, "korean_content_scarcity": 2},
      "score_reasons": {
        "event_pull": "세계적으로 알려진 사건과 미해결 인식이 강하게 끈다.",
        "causal_depth": "화재·열팽창·기둥 손실의 연쇄를 다룰 수 있다.",
        "belief_reversal": "항공기 충돌이 없었다는 통념과 화재 붕괴가 충돌한다.",
        "evidence_verifiability": "NIST 근거는 풍부하지만 논쟁적 주장 분리가 필수다.",
        "narrative_expandability": "사건·조사·오해 검증을 장편 서사로 펼칠 수 있다.",
        "visual_explainability": "내부 열팽창과 진행성 붕괴는 세심한 3D 설명이 필요하다.",
        "meaning_and_lessons": "장시간 화재와 구조 시스템 상호작용의 교훈이 있다.",
        "korean_content_scarcity": "한국어 관련 콘텐츠가 많아 희소성은 낮을 가능성이 크다."
      }
    },
    {
      "id": "silver-bridge",
      "title": "실버 브리지 붕괴",
      "location": "Point Pleasant, West Virginia–Gallipolis, Ohio, United States",
      "collapse_date": "1967-12-15",
      "structure_type": "eyebar-chain suspension bridge",
      "collapse_extent": "whole",
      "one_line_question": "눈에 보이지 않던 작은 균열은 어떻게 다리 전체를 연쇄 붕괴시켰나?",
      "provisional": true,
      "scope": {"human_made_structure": true, "physical_collapse": true, "scope_verified": true},
      "sources": [{
        "title": "Collapse of U.S. 35 Highway Bridge, Point Pleasant, West Virginia",
        "institution": "National Transportation Safety Board",
        "class": "official_or_primary",